section,text
413c,I am sure you too would say are they who alter their opinions under the spell of pleasure or terrified by some fear.
413d,and who cannot be beguiled we must accept and the other kind we must cross off from our list. Is not that so?
413e,"and again pass them into pleasures, testing them much more carefully than men do gold in the fire, to see if the man remains immune to such witchcraft and preserves his composure throughout, a good guardian of himself and the culture which he has received, maintaining the true rhythm and harmony of his being in all those conditions, and the character that would make him most useful to himself and to the state."
414a,"and issues from it unspoiled we must establish as ruler over our city and its guardian, and bestow rewards upon him in life, and in death the allotment of the supreme honors of burial-rites and other memorials. But the man of the other type we must reject. Such,"
414b,"be most proper to designate these as guardians in the full sense of the word, watchers against foemen without and friends within, so that the latter shall not wish and the former shall not be able to work harm, but to name those youths whom we were calling guardians just now, helpers and aids for the decrees of the rulers?"
414c,"so as by one noble lie to persuade if possible the rulers themselves, but failing that the rest of the city?"
414d,"Say on, said he, and don’t be afraid. Very well, I will. And yet I hardly know how to find the audacity or the words to speak and undertake to persuade first the rulers themselves and the soldiers and then the rest of the city, that in good sooth all our training and educating of them were things that they imagined and that happened to them as it were in a dream; but that in reality at that time they were down within the earth being molded and fostered themselves while  their weapons and the rest of their equipment were being fashioned. And when they were quite finished the earth as being their mother delivered them, and now as if their land were their mother and their nurse they ought to take thought for her and defend her against any attack and regard the other citizens as their brothers and children of the self-same earth. It is not for nothing, he said, that you were so bashful about coming out with your lie."
414e,"their weapons and the rest of their equipment were being fashioned. And when they were quite finished the earth as being their mother delivered them, and now as if their land were their mother and their nurse they ought to take thought for her and defend her against any attack and regard the other citizens as their brothers and children of the self-same earth."
415a,"I said; but all the same hear the rest of the story. While all of you in the city are brothers, we will say in our tale, yet God in fashioning those of you who are fitted to hold rule mingled gold in their generation, for which reason they are the most precious—but in the helpers silver, and iron and brass in the farmers and other craftsmen. And as you are all akin, though for the most part you will breed after your kinds,  it may sometimes happen that a golden father would beget a silver son and that a golden offspring would come from a silver sire and that the rest would in like manner be born of one another. So that the first and chief injunction that the god lays upon the rulers is that of nothing else are they to be such careful guardians and so intently observant as of the intermixture of these metals in the souls of their offspring, and if sons are born to them with an infusion of brass or iron   they shall by no means give way to pity in their treatment of them, but shall assign to each the status due to his nature and thrust them out among the artisans or the farmers. And again, if from these there is born a son with unexpected gold or silver in his composition they shall honor such and bid them go up higher, some to the office of guardian, some to the assistanceship, alleging that there is an oracle that the state shall then be overthrown when the man of iron or brass is its guardian. Do you see any way of getting them to believe this tale?"
415b,"it may sometimes happen that a golden father would beget a silver son and that a golden offspring would come from a silver sire and that the rest would in like manner be born of one another. So that the first and chief injunction that the god lays upon the rulers is that of nothing else are they to be such careful guardians and so intently observant as of the intermixture of these metals in the souls of their offspring, and if sons are born to them with an infusion of brass or iron"
415c,"they shall by no means give way to pity in their treatment of them, but shall assign to each the status due to his nature and thrust them out among the artisans or the farmers. And again, if from these there is born a son with unexpected gold or silver in his composition they shall honor such and bid them go up higher, some to the office of guardian, some to the assistanceship, alleging that there is an oracle that the state shall then be overthrown when the man of iron or brass is its guardian. Do you see any way of getting them to believe this tale?"
415d,"No, not these themselves, he said, but I do, their sons and successors and the rest of mankind who come after. Well, said I, even that would have a good effect making them more inclined to care for the state and one another. For I think I apprehend your meaning. XXII. And this shall fall out as tradition guides.
But let us arm these sons of earth and conduct them under the leadership of their rulers. And when they have arrived they must look out for the fairest site in the city for their encampment,  a position from which they could best hold down rebellion against the laws from within and repel aggression from without as of a wolf against the fold. And after they have encamped and sacrificed to the proper gods they must make their lairs, must they not? Yes, he said. And these must be of a character keep out the cold in winter and be sufficient in summer? Of course. For I presume you are speaking of their houses. Yes, said I, the houses of soldiers not of money-makers."
415e,"a position from which they could best hold down rebellion against the laws from within and repel aggression from without as of a wolf against the fold. And after they have encamped and sacrificed to the proper gods they must make their lairs, must they not?"
416a,"What distinction do you intend by that? he said. I will try to tell you, I said. It is surely the most monstrous and shameful thing in the world for shepherds to breed the dogs who are to help them with their flocks in such wise and of such a nature that from indiscipline or hunger or some other evil condition the dogs themselves shall attack the sheep and injure them and be likened to wolves instead of dogs. A terrible thing, indeed, he said."
416b,"Must we not then guard by every means in our power against our helpers treating the citizens in any such way and, because they are the stronger, converting themselves from benign assistants into savage masters? We must, he said. And would they not have been provided with the chief safeguard if their education has really been a good one? But it surely has, he said. That, said I, dear Glaucon, we may not properly affirm, but what we were just now saying we may,   that they must have the right education, whatever it is, if they are to have what will do most to make them gentle to one another and to their charges. That is right, he said. In addition, moreover, to such an education a thoughtful man would affirm that their houses and the possessions provided for them ought to be such as not to interfere with the best performance of their own work as guardians and not to incite them to wrong the other citizens."
416c,"that they must have the right education, whatever it is, if they are to have what will do most to make them gentle to one another and to their charges."
416d,"He will rightly affirm that. Consider then, said I, whether, if that is to be their character, their habitations and ways of life must not be something after this fashion. In the first place, none must possess any private property save the indispensable. Secondly, none must have any habitation or treasure-house which is not open for all to enter at will. Their food, in such quantities as are needful for athletes of war sober and brave,   they must receive as an agreed stipend from the other citizens as the wages of their guardianship, so measured that there shall be neither superfluity at the end of the year nor any lack. And resorting to a common mess like soldiers on campaign they will live together."
416e,"they must receive as an agreed stipend from the other citizens as the wages of their guardianship, so measured that there shall be neither superfluity at the end of the year nor any lack. And resorting to a common mess like soldiers on campaign they will live together."
417a,"the coin of the multitude, while that which dwells within them is unsullied. But for these only of all the dwellers in the city it is not lawful to handle gold and silver and to touch them nor yet to come under the same roof with them, nor to hang them as ornaments on their limbs nor to drink from silver and gold. So living they would save themselves and save their city. But whenever they shall acquire for themselves land of their own and houses and coin, they will be house-holders and farmers instead of guardians, and will be transformed"
417b,"from the helpers of their fellow citizens to their enemies and masters, and so in hating and being hated, plotting and being plotted against they will pass their days fearing far more and rather the townsmen within than the foemen without—and then even then laying the course of near shipwreck for themselves and the state. For all these reasons,"
