section,text
620a,"He said it was a strange, pitiful, and ridiculous spectacle, as the choice was determined for the most part by the habits of their former lives. He saw the soul that had been Orpheus’, he said, selecting the life of a swan, because from hatred of the tribe of women, owing to his death at their hands, it was unwilling to be conceived and born of a woman. He saw the soul of Thamyras choosing the life of a nightingale; and he saw a swan changing to the choice of the life of man, and similarly other musical animals."
620b,"The soul that drew the twentieth lot chose the life of a lion; it was the soul of Ajax, the son of Telamon, which, because it remembered the adjudication of the arms of Achilles, was unwilling to become a man. The next, the soul of Agamemnon, likewise from hatred of the human race because of its sufferings, substituted the life of an eagle. Drawing one of the middle lots the soul of Atalanta caught sight of the great honors attached to an athlete’s life and could not pass them by but snatched at them."
620c,"After her, he said, he saw the soul of Epeius, the son of Panopeus, entering into the nature of an arts and crafts woman. Far off in the rear he saw the soul of the buffoon Thersites clothing itself in the body of an ape. And it fell out that the soul of Odysseus drew the last lot of all and came to make its choice, and, from memory of its former toils having flung away ambition, went about for a long time in quest of the life of an ordinary citizen who minded his own business, and with difficulty found it lying in some corner disregarded by the others,"
620d,"and upon seeing it said that it would have done the same had it drawn the first lot, and chose it gladly. And in like manner, of the other beasts some entered into men and into one another, the unjust into wild creatures, the just transformed to tame, and there was every kind of mixture and combination. But when, to conclude, all the souls had chosen their lives in the order of their lots, they were marshalled and went before Lachesis. And she sent with each,"
620e,"as the guardian of his life and the fulfiller of his choice, the genius that he had chosen, and this divinity led the soul first to Clotho, under her hand and her turning of the spindle to ratify the destiny of his lot and choice; and after contact with her the genius again led the soul to the spinning of Atropos to make the web of its destiny irreversible,"
621a,"And after it had passed through that, when the others also had passed, they all journeyed to the Plain of Oblivion, through a terrible and stifling heat, for it was bare of trees and all plants, and there they camped at eventide by the River of Forgetfulness, whose waters no vessel can contain. They were all required to drink a measure of the water, and those who were not saved by their good sense drank more than the measure, and each one as he drank forgot all things."
621b,"And after they had fallen asleep and it was the middle of the night, there was a sound of thunder and a quaking of the earth, and they were suddenly wafted thence, one this way, one that, upward to their birth like shooting stars. Er himself, he said, was not allowed to drink of the water, yet how and in what way he returned to the body he said he did not know, but suddenly recovering his sight he saw himself at dawn lying on the funeral pyre.—And so, Glaucon, the tale was saved, as the saying is, and was not lost."
621c,"And it will save us if we believe it, and we shall safely cross the River of Lethe, and keep our soul unspotted from the world. But if we are guided by me we shall believe that the soul is immortal and capable of enduring all extremes of good and evil, and so we shall hold ever to the upward way and pursue righteousness with wisdom always and ever, that we may be dear to ourselves and to the gods both during our sojourn here and when we receive our reward,"
621d,"as the victors in the games go about to gather in theirs. And thus both here and in that journey of a thousand years, whereof I have told you, we shall fare well."
