section,text
543a,"Very good. We are agreed then, Glaucon, that the state which is to achieve the height of good government must have community of wives and children and all education, and also that the pursuits of men and women must be the same in peace and war, and that the rulers or kings over them are to be those who have approved themselves the best in both war and philosophy. We are agreed, he said. And we further granted this,   that when the rulers are established in office they shall conduct these soldiers and settle them in habitations such as we described, that have nothing private for anybody but are common for all, and in addition to such habitations we agreed, if you remember, what should be the nature of their possessions. Why, yes, I remember, he said, that we thought it right that none of them should have anything that ordinary men now possess, but that, being as it were athletes  of war and guardians, they should receive from the others as pay for their guardianship each year their yearly sustenance, and devote their entire attention to the care of themselves and the state. That is right, I said. But now that we have finished this topic let us recall the point at which we entered on the digression that has brought us here, so that we may proceed on our way again by the same path. That is easy, he said; for at that time, almost exactly as now, on the supposition that you had finished the description of the city, you were going on to say that you assumed such a city  as you then described and the corresponding type of man to be good, and that too though, as it appears, you had a still finer city and type of man to tell of;"
543b,"that when the rulers are established in office they shall conduct these soldiers and settle them in habitations such as we described, that have nothing private for anybody but are common for all, and in addition to such habitations we agreed, if you remember, what should be the nature of their possessions."
543c,"of war and guardians, they should receive from the others as pay for their guardianship each year their yearly sustenance, and devote their entire attention to the care of themselves and the state."
543d,"as you then described and the corresponding type of man to be good, and that too though, as it appears, you had a still finer city and type of man to tell of;"
544a,"but at any rate you were saying that the others are aberrations, if this city is right. But regarding the other constitutions, my recollection is that you said there were four species worth speaking of and observing their defects and the corresponding types of men, in order that when we had seen them all and come to an agreement about the best and the worst man, we might determine whether the best is the happiest and the worst most wretched or whether it is otherwise. And when I was asking what were"
544b,"the four constitutions you had in mind, Polemarchus and Adeimantus thereupon broke in, and that was how you took up the discussion again and brought to this point."
544c,"There will be no difficulty about that, said I. For those I mean are precisely those that have names in common usage: that which the many praised, your Cretan and Spartan constitution; and the second in place and in honor, that which is called oligarchy, a constitution teeming with many ills, and its sequent counterpart and opponent, democracy ; and then the noble tyranny surpassing them all, the fourth and final malady of a state.   Can you mention any other type of government, I mean any other that constitutes a distinct species? For, no doubt, there are hereditary principalities and purchased kingships, and similar intermediate constitutions which one could find in even greater numbers among the barbarians than among the Greeks. Certainly many strange ones are reported, he said. 
Are you aware, then, said I, that there must be as many types of character among men as there are forms of government? Or do you suppose that constitutions spring from the proverbial oak or rock and not from the characters of the citizens,  which, as it were, by their momentum and weight in the scales draw other things after them? They could not possibly come from any other source, he said. Then if the forms of government are five, the patterns of individual souls must be five also. Surely. Now we have already described the man corresponding to aristocracy or the government of the best, whom we aver to be the truly good and just man."
544d,"Can you mention any other type of government, I mean any other that constitutes a distinct species? For, no doubt, there are hereditary principalities and purchased kingships, and similar intermediate constitutions which one could find in even greater numbers among the barbarians than among the Greeks."
544e,"which, as it were, by their momentum and weight in the scales draw other things after them?"
545a,"We have. Must we not, then, next after this, survey the inferior types, the man who is contentious and covetous of honor, corresponding to the Laconian constitution, and the oligarchical man in turn, and the democratic and the tyrant, in order that, after observing the most unjust of all, we may oppose him to the most just, and complete our inquiry as to the relation of pure justice and pure injustice in respect of the happiness and unhappiness of the possessor, so that we may either follow the counsel of Thrasymachus and pursue injustice  or the present argument and pursue justice? Assuredly, he said, that is what we have to do. Shall we, then, as we began by examining moral qualities in states before individuals, as being more manifest there, so now consider first the constitution based on the love of honor? I do not know of any special name for it in use. We must call it either timocracy or timarchy. And then in connection with this  we will consider the man of that type, and thereafter oligarchy and the oligarch, and again, fixing our eyes on democracy, we will contemplate the democratic man: and fourthly, after coming to the city ruled by a tyrant and observing it, we will in turn take a look into the tyrannical soul, and so try to make ourselves competent judges of the question before us. That would be at least a systematic and consistent way of conducting the observation and the decision, he said. 
Come, then, said I, let us try to tell in what way a timocracy would arise out of an aristocracy.   Or is this the simple and unvarying rule, that in every form of government revolution takes its start from the ruling class itself, when dissension arises in that, but so long as it is at one with itself, however small it be, innovation is impossible? Yes, that is so. How, then, Glaucon, I said, will disturbance arise in our city, and how will our helpers and rulers fall out and be at odds with one another and themselves? Shall we, like Homer, invoke the Muses to tell how faction first fell upon them, Hom. Il. 1.6  and say that these goddesses playing with us and teasing us as if we were children address us in lofty, mock-serious tragic style?"
545b,or the present argument and pursue justice?
545c,"we will consider the man of that type, and thereafter oligarchy and the oligarch, and again, fixing our eyes on democracy, we will contemplate the democratic man: and fourthly, after coming to the city ruled by a tyrant and observing it, we will in turn take a look into the tyrannical soul, and so try to make ourselves competent judges of the question before us."
545d,"Or is this the simple and unvarying rule, that in every form of government revolution takes its start from the ruling class itself, when dissension arises in that, but so long as it is at one with itself, however small it be, innovation is impossible?"
545e,"and say that these goddesses playing with us and teasing us as if we were children address us in lofty, mock-serious tragic style?"
546a,How?
546b,"the men you have bred to be your rulers will not for all their wisdom ascertain by reasoning combined with sensation, but they will escape them, and there will be a time when they will beget children out of season. Now for divine begettings there is a period comprehended by a perfect number, and for mortal by the first in which augmentations dominating and dominated when they have attained to three distances and four limits of the assimilating and the dissimilating, the waxing and the waning, render all things conversable and commensurable"
546c,"with one another, whereof a basal four-thirds wedded to the pempad yields two harmonies at the third augmentation, the one the product of equal factors taken one hundred times, the other of equal length one way but oblong,—one dimension of a hundred numbers determined by the rational diameters of the pempad lacking one in each case, or of the irrational lacking two; the other dimension of a hundred cubes of the triad. And this entire geometrical number is determinative of this thing, of better and inferior births."
546d,"And when your guardians, missing this, bring together brides and bridegrooms unseasonably, the offspring will not be well-born or fortunate. Of such offspring the previous generation will establish the best, to be sure, in office, but still these, being unworthy, and having entered in turn into the powers of their fathers, will first as guardians begin to neglect us, paying too little heed to music and then to gymnastics, so that our young men will deteriorate in their culture; and the rulers selected from them"
546e,will not approve themselves very efficient guardians for testing
547a,"Hesiod’s and our races of gold, silver, bronze and iron."
547b,"Well, then, said he, what do the Muses say next? When strife arose, said I, the two groups were pulling against each other, the iron and bronze towards money-making and the acquisition of land and houses and gold and silver, and the other two, the golden and silvern, not being poor, but by nature rich in their souls, were trying to draw them back to virtue and their original constitution, and thus, striving and contending against one another, they compromised on the plan of distributing and taking for themselves the land and the houses,   enslaving and subjecting as perioeci and serfs their former friends and supporters, of whose freedom they had been the guardians, and occupying themselves with war and keeping watch over these subjects. I think, he said, that this is the starting-point of the transformation. Would not this polity, then, said I, be in some sort intermediate between aristocracy and oligarchy ? By all means.
By this change, then, it would arise. But after the change   what will be its way of life? Is it not obvious that in some things it will imitate the preceding polity, in some the oligarchy, since it is intermediate, and that it will also have some qualities peculiar to itself? That is so, he said. Then in honoring its rulers and in the abstention of its warrior class from farming and handicraft and money-making in general, and in the provision of common public tables and the devotion to physical training and expertness in the game and contest of war—in all these traits it will copy the preceding state? Yes. But in its fear   to admit clever men to office, since the men it has of this kind are no longer simple and strenuous but of mixed strain, and in its inclining rather to the more high-spirited and simple-minded type, who are better suited for war  than for peace, and in honoring the stratagems and contrivances of war and occupying itself with war most of the time—in these respects for the most part its qualities will be peculiar to itself?"
547c,"enslaving and subjecting as perioeci and serfs their former friends and supporters, of whose freedom they had been the guardians, and occupying themselves with war and keeping watch over these subjects."
547d,"what will be its way of life? Is it not obvious that in some things it will imitate the preceding polity, in some the oligarchy, since it is intermediate, and that it will also have some qualities peculiar to itself?"
547e,"to admit clever men to office, since the men it has of this kind are no longer simple and strenuous but of mixed strain, and in its inclining rather to the more high-spirited and simple-minded type, who are better suited for war"
548a,"than for peace, and in honoring the stratagems and contrivances of war and occupying itself with war most of the time—in these respects for the most part its qualities will be peculiar to itself?"
548b,and any others they please with great expenditure.
548c,and because of their preference of gymnastics to music?
548d,"of a constitution in words and not elaborate it precisely, since even the sketch will suffice to show us the most just and the most unjust type of man, and it would be an impracticable task to set forth all forms of government without omitting any, and all customs and qualities of men."
548e,in point of contentiousness.
549a,"and to slaves such a one would be harsh, not scorning them as the really educated do, but he would be gentle with the freeborn and very submissive to officials, a lover of office and of honor, not basing his claim to office on ability to speak or anything of that sort but on his exploits in war or preparation for war, and he would be a devotee of gymnastics and hunting."
549b,"be disdainful of wealth too in his youth, but the older he grew the more he would love it because of his participation in the covetous nature and because his virtue is not sincere and pure since it lacks the best guardian?"
549c,"His origin is somewhat on this wise: Sometimes he is the young son of a good father who lives in a badly governed state and avoids honors and office and law-suits and all such meddlesomeness and is willing to forbear something of his rights in order to escape trouble. How does he originate? he said. Why, when, to begin with, I said, he hears his mother complaining  that her husband is not one of the rulers and for that reason she is slighted among the other women, and when she sees that her husband is not much concerned about money and does not fight and brawl in private lawsuits and in the public assembly, but takes all such matters lightly, and when she observes that he is self-absorbed in his thoughts and neither regards nor disregards her overmuch, and in consequence of all this laments and tells the boy that his father is too slack and no kind of a man, with all the other complaints   with which women nag in such cases. Many indeed, said Adeimantus, and after their kind."
549d,"that her husband is not one of the rulers and for that reason she is slighted among the other women, and when she sees that her husband is not much concerned about money and does not fight and brawl in private lawsuits and in the public assembly, but takes all such matters lightly, and when she observes that he is self-absorbed in his thoughts and neither regards nor disregards her overmuch, and in consequence of all this laments and tells the boy that his father is too slack and no kind of a man, with all the other complaints"
549e,with which women nag in such cases.
550a,"and prove himself more of a man than his father, and when the lad goes out he hears and sees the same sort of thing. Men who mind their own affairs in the city are spoken of as simpletons and are held in slight esteem, while meddlers who mind other people’s affairs are honored and praised. Then it is that the youth, hearing and seeing such things, and on the other hand listening to the words of his father, and with a near view of his pursuits contrasted with those of other men, is solicited by both, his father"
550b,"watering and fostering the growth of the rational principle in his soul and the others the appetitive and the passionate; and as he is not by nature of a bad disposition but has fallen into evil communications, under these two solicitations he comes to a compromise and turns over the government in his soul to the intermediate principle of ambition and high spirit and becomes a man haughty of soul and covetous of honor."
550c,"Then, said I, we have our second polity and second type of man. We have, he said. 
Shall we then, as Aeschylus: would say, tell of another champion before another gate, Aesch. Seven 451  or rather, in accordance with our plan, the city first? That, by all means, he said. The next polity, I believe, would be oligarchy. And what kind of a regime, said he, do you understand by oligarchy? That based on a property qualification, said I, wherein the rich hold office   and the poor man is excluded. I understand, said he. Then, is not the first thing to speak of how democracy passes over into this? Yes. And truly, said I, the manner of the change is plain even to the proverbial blind man. How so? That treasure-house which each possesses filled with gold destroys that polity; for first they invent ways of expenditure for themselves and pervert the laws to this end,   and neither they nor their wives obey them. That is likely, he said. And then, I take it, by observing and emulating one another they bring the majority of them to this way of thinking. That is likely, he said. And so, as time goes on, and they advance in the pursuit of wealth, the more they hold that in honor the less they honor virtue. May not the opposition of wealth and virtue be conceived as if each lay in the scale of a balance inclining opposite ways? Yes, indeed, he said."
550d,and the poor man is excluded.
550e,and neither they nor their wives obey them.
551a,"in a state, and the wealthy, virtue and the good are less honored."
551b,"defining the limits of an oligarchical polity, prescribing a sum of money, a larger sum where it is more of an oligarchy, where it is less a smaller, and proclaiming that no man shall hold office whose property does not come up to the required valuation? And this law they either put through by force of arms, or without resorting to that they establish their government by terrorization. Is not that the way of it?"
551c,it had?
551d,"Here, then, is one very great defect in oligarchy. So it appears. Well, and is this a smaller one? What? That such a city should of necessity be not one, but two, a city of the rich and a city of the poor, dwelling together, and always plotting against one another. No, by Zeus, said he, it is not a bit smaller. Nor, further, can we approve of this—the likelihood that they will not be able to wage war, because of the necessity of either arming and employing the multitude,  and fearing them more than the enemy, or else, if they do not make use of them, of finding themselves on the field of battle, oligarchs indeed, and rulers over a few. And to this must be added their reluctance to contribute money, because they are lovers of money. No, indeed, that is not admirable."
551e,"and fearing them more than the enemy, or else, if they do not make use of them, of finding themselves on the field of battle, oligarchs indeed, and rulers over a few. And to this must be added their reluctance to contribute money, because they are lovers of money."
552a,financiers and soldiers all in one? Do you think that is right?
552b,"This is the first, he said. There certainly is no prohibition of that sort of thing in oligarchical states. Otherwise some of their citizens would not be excessively rich, and others out and out paupers. Right.  But observe this. When such a fellow was spending his wealth, was he then of any more use to the state in the matters of which we were speaking, or did he merely seem to belong to the ruling class, while in reality he was neither ruler nor helper in the state, but only a consumer of goods? It is so, he said; he only seemed, but was   just a spendthrift. Shall we, then, say of him that as the drone springs up in the cell, a pest of the hive, so such a man grows up in his home, a pest of the state? By all means, Socrates, he said. And has not God, Adeimantus, left the drones which have wings and fly stingless one and all, while of the drones here who travel afoot he has made some stingless but has armed others with terrible stings? And from the stingless finally issue beggars in old age,  but from those furnished with stings all that are denominated malefactors? Most true, he said. It is plain, then, said I, that wherever you see beggars in a city, there are somewhere in the neighborhood concealed thieves and cutpurses and temple-robbers and similar artists in crime. Clearly, he said. Well, then, in oligarchical cities do you not see beggars? Nearly all are such, he said, except the ruling class. Are we not to suppose, then,   that there are also many criminals in them furnished with stings, whom the rulers by their surveillance forcibly restrain? We must think so, he said. And shall we not say that the presence of such citizens is the result of a defective culture and bad breeding and a wrong constitution of the state? We shall. Well, at any rate such would be the character of the oligarchical state, and these, or perhaps even more than these, would be the evils that afflict it. Pretty nearly these, he said."
552c,just a spendthrift.
552d,but from those furnished with stings all that are denominated malefactors?
552e,"that there are also many criminals in them furnished with stings, whom the rulers by their surveillance forcibly restrain?"
553a,"Then, I said, let us regard as disposed of the constitution called oligarchy, whose rulers are determined by a property qualification. And next we are to consider the man who resembles it—how he arises and what after that his character is. Quite so, he said. 
Is not the transition from that timocratic youth to the oligarchical type mostly on this wise? How? When a son born to the timocratic man at first emulates his father, and follows in his footsteps and then sees him   suddenly dashed, as a ship on a reef, against the state, and making complete wreckage of both his possessions and himself perhaps he has been a general, or has held some other important office, and has then been dragged into court by mischievous sycophants and put to death or banished or outlawed and has lost all his property— It is likely, he said. And the son, my friend, after seeing and suffering these things, and losing his property, grows timid, I fancy, and forthwith thrusts headlong from his bosom’s throne  that principle of love of honor and that high spirit, and being humbled by poverty turns to the getting of money, and greedily and stingily and little by little by thrift and hard work collects property. Do you not suppose that such a one will then establish on that throne the principle of appetite and avarice, and set it up as the great king in his soul, adorned with tiaras and collars of gold, and girt with the Persian sword? I do, he said. And under this domination he will force the rational   and high-spirited principles to crouch lowly to right and left as slaves, and will allow the one to calculate and consider nothing but the ways of making more money from a little, and the other to admire and honor nothing but riches and rich men, and to take pride in nothing but the possession of wealth and whatever contributes to that? There is no other transformation so swift and sure of the ambitious youth into the avaricious type."
553b,"suddenly dashed, as a ship on a reef, against the state, and making complete wreckage of both his possessions and himself perhaps he has been a general, or has held some other important office, and has then been dragged into court by mischievous sycophants and put to death or banished or outlawed and has lost all his property—"
553c,"that principle of love of honor and that high spirit, and being humbled by poverty turns to the getting of money, and greedily and stingily and little by little by thrift and hard work collects property. Do you not suppose that such a one will then establish on that throne the principle of appetite and avarice, and set it up as the great king in his soul, adorned with tiaras and collars of gold, and girt with the Persian sword?"
553d,"and high-spirited principles to crouch lowly to right and left as slaves, and will allow the one to calculate and consider nothing but the ways of making more money from a little, and the other to admire and honor nothing but riches and rich men, and to take pride in nothing but the possession of wealth and whatever contributes to that?"
553e,"Is this, then, our oligarchical man? said I. He is developed, at any rate, out of a man resembling the constitution from which the oligarchy sprang."
554a,"Let us see, then, whether he will have a like character."
554b,"and a hoarder, the type the multitude approves. Would not this be the character of the man who corresponds to such a polity?"
554c,"some the beggarly, others the rascally, but that they are forcibly restrained by his general self-surveillance and self- control?"
554d,"forcibly keeps down other evil desires dwelling within, not persuading them that it is better not nor taming them by reason, but by compulsion and fear, trembling for his possessions generally."
554e,his better desires would have the upper hand over the worse.
555a,"in the city for any prize of victory or in any other honorable emulation. He is unwilling to spend money for fame and rivalries of that sort, and, fearing to awaken his prodigal desires and call them into alliance for the winning of the victory, he fights in true oligarchical fashion with a small part of his resources and is defeated for the most part and—finds himself rich!"
555b,and the oligarchical state?
