section,text
555c,"In what way? Why, since its rulers owe their offices to their wealth, they are not willing to prohibit by law the prodigals who arise among the youth from spending and wasting their substance. Their object is, by lending money on the property of such men, and buying it in, to become still richer and more esteemed. By all means. And is it not at once apparent in a state that this honoring of wealth is incompatible with a sober and temperate citizenship,  but that one or the other of these two ideals is inevitably neglected. That is pretty clear, he said. And such negligence and encouragement of licentiousness in oligarchies not infrequently has reduced to poverty men of no ignoble quality. It surely has. And there they sit, I fancy, within the city, furnished with stings, that is, arms, some burdened with debt, others disfranchised, others both, hating and conspiring against the acquirers of their estates and the rest of the citizens,   and eager for revolution. ’Tis so."
555d,but that one or the other of these two ideals is inevitably neglected.
555e,and eager for revolution.
556a,foster the drone and pauper element in the state.
556b,the pursuit of wealth would be less shameless in the state and fewer of the evils of which we spoke just now would grow up there.
556c,"and too soft to stand up against pleasure and pain, and mere idlers?"
556d,"or, for that matter, in actual battle, and observe one another, then the poor are not in the least scorned by the rich, but on the contrary, do you not suppose it often happens that when a lean, sinewy, sunburnt pauper is stationed in battle beside a rich man bred in the shade, and burdened with superfluous flesh, and sees him panting and helpless—do you not suppose he will think that such fellows keep their wealth by the cowardice of the poor, and that when the latter are together in private,"
556e,one will pass the word to another our men are good for nothing?
557a,apart from any external impulse faction arises?
557b,and what is the quality of such a constitution? For it is plain that the man of this quality will turn out to be a democratic sort of man.
557c,"then, would arise in this polity more than in any other?"
557d,"Yes indeed, he said. Yes, said I, and it is the fit place, my good friend, in which to look for a constitution. Why so? Because, owing to this licence, it includes all kinds, and it seems likely that anyone who wishes to organize a state, as we were just now doing, must find his way to a democratic city and select the model that pleases him, as if in a bazaar of constitutions, and after making his choice, establish his own. Perhaps at any rate, he said,"
557e,he would not be at a loss for patterns.
558a,"if it occurs to you to do so, is not all that a heavenly and delicious entertainment for the time being?"
558b,"its superiority to all our meticulous requirements, its disdain or our solemn pronouncements made when we were founding our city, that except in the case of transcendent natural gifts no one could ever become a good man unless from childhood his play and all his pursuits were concerned with things fair and good,—how superbly it tramples under foot all such ideals, caring nothing from what practices and way of life a man turns to politics, but honoring him"
558c,if only he says that he loves the people!
558d,would have a son bred in his father’s ways.
558e,"and likewise those whose satisfaction is beneficial to us, may they not? For our nature compels us to seek their satisfaction."
559a,Is not that so ?
559b,for mere bread and relishes be necessary?
559c,intelligence and sobriety?
559d,by his necessary appetites is the thrifty oligarchical man?
559e,of the transformation of the oligarchy in his soul into democracy.
560a,"or from his other kin, who admonish and reproach him, then there arises faction and counter-faction and internal strife in the man with himself."
560b,"are stealthily nurtured to take their place, owing to the father’s ignorance of true education, and wax numerous and strong."
560c,and guardians in the minds of men who are dear to the gods.
560d,"and refuse admission to the auxiliary force itself, and will not grant audience as to envoys to the words of older friends in private life. And they themselves prevail in the conflict, and naming reverence and awe folly thrust it forth, a dishonored fugitive. And temperance they call want of manhood and banish it with contumely, and they teach that moderation and orderly expenditure are rusticity and illiberality, and they combine with a gang of unprofitable and harmful appetites to drive them over the border."
560e,"and purged of all these the soul of the youth that they have thus possessed and occupied, and whom they are initiating with these magnificent and costly rites, they proceed to lead home from exile insolence and anarchy and prodigality and shamelessness, resplendent in a great attendant choir and crowned with garlands, and in celebration of their praises they euphemistically denominate insolence good breeding, licence liberty, prodigality magnificence,"
561a,and shamelessness manly spirit.
561b,"the fiercest tumult within him passes, and he receives back a part of the banished elements and does not abandon himself altogether to the invasion of the others, then he establishes and maintains all his pleasures on a footing of equality, forsooth, and so lives turning over the guard-house of his soul to each as it happens along until it is sated, as if it had drawn the lot for that office, and then in turn to another, disdaining none but fostering them all equally."
561c,"that some pleasures arise from honorable and good desires, and others from those that are base, and that we ought to practise and esteem the one and control and subdue the others; but he shakes his head at all such admonitions and avers that they are all alike and to be equally esteemed."
561d,"and at one time exercising his body, and sometimes idling and neglecting all things, and at another time seeming to occupy himself with philosophy. And frequently he goes in for politics and bounces up and says and does whatever enters his head. And if military men excite his emulation, thither he rushes, and if moneyed men, to that he turns, and there is no order or compulsion in his existence, but he calls this life of his the life of pleasure and freedom and happiness and"
561e,cleaves to it to the end.
562a,"Shall we definitely assert, then, that such a man is to be ranged with democracy and would properly be designated as democratic? Let that be his place, he said. 
And now, said I, the fairest polity and the fairest man remain for us to describe, the tyranny and the tyrant. Certainly, he said. Come then, tell me, dear friend, how tyranny arises. That it is an outgrowth of democracy is fairly plain. Yes, plain. Is it, then, in a sense, in the same way in which democracy arises out of oligarchy that tyranny arises from democracy?"
562b,"How is that? The good that they proposed to themselves and that was the cause of the establishment of oligarchy—it was wealth, was it not? Yes. Well, then, the insatiate lust for wealth and the neglect of everything else for the sake of money-making was the cause of its undoing. True, he said. And is not the avidity of democracy for that which is its definition and criterion of good the thing which dissolves it too? What do you say its criterion to be? Liberty, I replied; for you may hear it said that this is best managed in a democratic city,  and for this reason that is the only city in which a man of free spirit will care to live. Why, yes, he replied, you hear that saying everywhere. Then, as I was about to observe, is it not the excess and greed of this and the neglect of all other things that revolutionizes this constitution too and prepares the way for the necessity of a dictatorship? How? he said. Why, when a democratic city athirst for liberty gets bad cupbearers  for its leaders and is intoxicated by drinking too deep of that unmixed wine, and then, if its so-called governors are not extremely mild and gentle with it and do not dispense the liberty unstintedly,it chastises them and accuses them of being accursed oligarchs. Yes, that is what they do, he replied. But those who obey the rulers, I said, it reviles as willing slaves and men of naught, but it commends and honors in public and private rulers who resemble subjects and subjects who are like rulers.  Is it not inevitable that in such a state the spirit of liberty should go to all lengths? Of course. And this anarchical temper, said I, my friend, must penetrate into private homes and finally enter into the very animals. Just what do we mean by that? he said."
562c,and for this reason that is the only city in which a man of free spirit will care to live.
562d,"for its leaders and is intoxicated by drinking too deep of that unmixed wine, and then, if its so-called governors are not extremely mild and gentle with it and do not dispense the liberty unstintedly,it chastises them and accuses them of being accursed oligarchs."
562e,Is it not inevitable that in such a state the spirit of liberty should go to all lengths?
563a,"so that he may be forsooth a free man. And the resident alien feels himself equal to the citizen and the citizen to him, and the foreigner likewise."
563b,"are full of pleasantry and graciousness, imitating the young for fear they may be thought disagreeable and authoritative."
563c,"Shall we not, then, said he, in Aeschylean phrase, say whatever rises to our lips? Certainly, I said, so I will. Without experience of it no one would believe how much freer the very beasts subject to men are in such a city than elsewhere. The dogs literally verify the adage and like their mistresses become. And likewise the horses and asses are wont to hold on their way with the utmost freedom and dignity, bumping into everyone who meets them and who does not step aside. And so all things everywhere are just bursting with the spirit of liberty."
563d,"It is my own dream you are telling me, he said; for it often happens to me when I go to the country. And do you note that the sum total of all these items when footed up is that they render the souls of the citizens so sensitive that they chafe at the slightest suggestion of servitude and will not endure it? For you are aware that they finally pay no heed even to the laws written or unwritten,  so that forsooth they may have no master anywhere over them. I know it very well, said he. 
This, then, my friend, said I, is the fine and vigorous root from which tyranny grows, in my opinion. Vigorous indeed, he said; but what next?"
563e,so that forsooth they may have no master anywhere over them.
564a,"in plants, in animal bodies, and most especially in political societies."
564b,arising in democracy as well as in oligarchy enslaves it?
564c,"And so a good physician and lawgiver must be on his guard from afar against the two kinds, like a prudent apiarist, first and chiefly to prevent their springing up, but if they do arise to have them as quickly as may be cut out, cells and all."
564d,"as we have described, grows up in it because of the licence, no less than in the oligarchic state."
564e,"tolerates no dissent, so that everything with slight exceptions is administered by that class in such a state."
565a,"And the third class, composing the people, would comprise all quiet cultivators of their own farms who possess little property. This is the largest and most potent group in a democracy when it meets in assembly. Yes, it is, he said, but it will not often do that, unless it gets a share of the honey. Well, does it not always share, I said, to the extent that the men at the head find it possible, in distributing to the people what they take from the well-to-do, to keep the lion’s share for themselves? Why, yes, he said, it shares  in that sense. And so, I suppose, those who are thus plundered are compelled to defend themselves by speeches in the assembly and any action in their power. Of course. And thereupon the charge is brought against them by the other party, though they may have no revolutionary designs, that they are plotting against the people, and it is said that they are oligarchs. Surely. And then finally, when they see the people, not of its own will but through misapprehension, and being misled   by the calumniators, attempting to wrong them, why then, whether they wish it or not, they become in very deed oligarchs, not willingly, but this evil too is engendered by those drones which sting them. Precisely. And then there ensue impeachments and judgements and lawsuits on either side. Yes, indeed. And is it not always the way of a demos to put forward one man as its special champion and protector and cherish and magnify him? Yes, it is. This, then, is plain,"
565b,in that sense.
565c,"by the calumniators, attempting to wrong them, why then, whether they wish it or not, they become in very deed oligarchs, not willingly, but this evil too is engendered by those drones which sting them."
565d,"said I, that when a tyrant arises he sprouts from a protectorate root and from nothing else. Very plain. What, then, is the starting-point of the transformation of a protector into a tyrant? Is it not obviously when the protector’s acts begin to reproduce the legend that is told of the shrine of Lycaean Zeus in Arcadia? What is that? he said. The story goes that he who tastes of the one bit of human entrails minced up with those of other victims   is inevitably transformed into a wolf. Have you not heard the tale? I have."
565e,is inevitably transformed into a wolf. Have you not heard the tale?
566a,banishes and slays and hints at the abolition of debts and the partition of lands—is it not the inevitable consequence and a decree of fate that such a one be either slain by his enemies or become a tyrant and be transformed from a man into a wolf?
566b,"to expel him or bring about his death by calumniating him to the people, they plot to assassinate him by stealth."
566c,"They do indeed, he said. And the people grant it, I suppose, fearing for him but unconcerned for themselves. Yes, indeed. And when he sees this, the man who has wealth and with his wealth the repute of hostility to democracy, then in the words of the oracle delivered to Croesus, By the pebble-strewn strand of the Hermos Swift is his flight, he stays not nor blushes to show the white feather. Hdt. 1.55 No, for he would never get a second chance to blush. And he who is caught, methinks, is delivered to his death. Inevitably. And then obviously that protector does not lie prostrate, mighty with far-flung limbs, Hom. Il. 16.776 in Homeric overthrow, but   overthrowing many others towers in the car of state transformed from a protector into a perfect and finished tyrant. What else is likely? he said. 
Shall we, then, portray the happiness, said I, of the man and the state in which such a creature arises? By all means let us describe it, he said. Then at the start and in the first days does he not smile upon all men and greet everybody he meets and deny that he is a tyrant,  and promise many things in private and public, and having freed men from debts, and distributed lands to the people and his own associates, he affects a gracious and gentle manner to all? Necessarily, he said. But when, I suppose, he has come to terms with some of his exiled enemies and has got others destroyed and is no longer disturbed by them, in the first place he is always stirring up some war so that the people may be in need of a leader. That is likely."
566d,overthrowing many others towers in the car of state transformed from a protector into a perfect and finished tyrant.
566e,"and promise many things in private and public, and having freed men from debts, and distributed lands to the people and his own associates, he affects a gracious and gentle manner to all?"
567a,"And also that being impoverished by war-taxes they may have to devote themselves to their daily business and be less likely to plot against him? Obviously. And if, I presume, he suspects that there are free spirits who will not suffer his domination, his further object is to find pretexts for destroying them by exposing them to the enemy? From all these motives a tyrant is compelled to be always provoking wars? Yes, he is compelled to do so. And by such conduct  will he not the more readily incur the hostility of the citizens? Of course. And is it not likely that some of those who helped to establish and now share in his power, voicing their disapproval of the course of events, will speak out frankly to him and to one another—such of them as happen to be the bravest? Yes, it is likely. Then the tyrant must do away with all such if he is to maintain his rule, until he has left no one of any worth, friend or foe. Obviously. He must look sharp to see, then,   who is brave, who is great-souled, who is wise, who is rich and such is his good fortune that, whether he wishes it or not, he must be their enemy and plot against them all until he purge the city. A fine purgation, he said. Yes, said I, just the opposite of that which physicians practise on our bodies. For while they remove the worst and leave the best, he does the reverse. Yes, for apparently he must, he said, if he is to keep his power.
Blessed, then, is the necessity that binds him,"
567b,will he not the more readily incur the hostility of the citizens?
567c,"who is brave, who is great-souled, who is wise, who is rich and such is his good fortune that, whether he wishes it or not, he must be their enemy and plot against them all until he purge the city."
567d,"said I, which bids him dwell for the most part with base companions who hate him, or else forfeit his life. Such it is, he said. And would he not, the more he offends the citizens by such conduct, have the greater need of more and more trustworthy bodyguards? Of course. Whom, then, may he trust, and whence shall he fetch them? Unbidden, he said, they will wing their way to him in great numbers if he furnish their wage. Drones, by the dog, I said, I think you are talking of again,   an alien and motley crew. You think rightly, he said. But what of the home supply, would he not choose to employ that? How? By taking their slaves from the citizens, emancipating them and enlisting them in his bodyguard. Assuredly, he said, since these are those whom he can most trust."
567e,an alien and motley crew.
568a,he must employ after destroying his former associates.
568b,Tyrants are wise by converse with the wise. He meant evidently that these associates of the tyrant are the wise.
568c,among them will pardon us.
568d,as it were from lack of breath unable to proceed.
568e,"But what when these resources fail? Clearly, he said, his father’s estate will have to support him and his wassailers, his fellows and his she-fellows. I understand, I said, that the people which begot the tyrant will have to feed him and his companions. It cannot escape from that, he said."
569a,"and that it did not beget and establish him in order that, when he had grown great, it, in servitude to its own slaves, should feed him and the slaves together with a nondescript rabble of aliens, but in order that, with him for protector, it might be liberated from the rule of the rich and the so-called better classes, and that it now bids him and his crew depart from the city as a father expels from his house a son together with troublesome revellers?"
569b,"what it is and what a creature it begot and cherished and bred to greatness, and that in its weakness it tries to expel the stronger."
569c,"into the fire of enslavement to slaves, and in exchange for that excessive and unseasonable liberty has clothed itself in the garb of the most cruel and bitter servile servitude."
